553907	Camp Concentration	Thomas M. Disch	Disch, Thomas M.		0375705457	9780375705458	3	3.8	Vintage	Paperback	192	1999	1968	2015/05/02	2015/05/02	america, sci-fi	america (#31), sci-fi (#38)	read							0
21086818	Do No Harm	Henry Marsh	Marsh, Henry		0297869876	9780297869870	4	4.29	Weidenfeld & Nicolson	Hardcover	278	2014	2014	2015/05/03	2015/04/25	medicine, non-fiction	medicine (#1), non-fiction (#59)	read	"<blockquote><br/>Are the thoughts that I am thinking as I look at this solid lump of fatty protein covered in blood vessels really made out of the same stuff? And the answer always comes back – they are – and the thought itself is too crazy, too incomprehensible, and I get on with the operation.<br/></blockquote><br/><br/>What an interesting, <i>human</i>, and very honest book - Marsh, nearly at the end of his career as a neurosurgeon, writes one chapter about something in his work that touched him - be it an operation that went wrong, or his fights with the hospital bureaucracy, his lifelong forays as a ""Western"" doctor into the post-Soviet Ukraine, personal anecdotes on having seizures and fear of cancer in the own family, and there's <i>so much regret</i>:<br/><br/><blockquote><br/>Early the next morning I lay in bed thinking about the young woman I had operated on the previous week. She had had a tumour in her spinal cord, between the sixth and seventh cervical vertebrae, and – although I do not know why, since the operation had seemed to proceed uneventfully – she awoke from the operation paralysed down the right side of her body. I had probably tried to take out too much of the tumour. I must have been too sure of myself. I had been insufficiently fearful. But I knew that however bitter my regret, and however well the pineal operation went, nothing I could do would undo the damage that I had done to the young woman.<br/></blockquote><br/><br/>Some minor quibbles are the parts on NHS bureaucracy are probably due to his rose-colored glasses of the past (""in my day we wouldn't have allowed this!"").<br/><br/>If you like thinking about your own demise, like to think about how medical doctors tick inside, or are into neurology, this should be for you. I think I'm getting this as a birthday present for my soon-to-retire-from-medicine father."						0
85863	Nova	Samuel R. Delany	Delany, Samuel R.		0375706704	9780375706707	3	3.83	Vintage	Paperback	256	2002	1968	2015/04/23	2015/04/22	america, sci-fi	america (#30), sci-fi (#37)	read	"The basic story is a space opera - we have two ""rich kids"" representing both of their federations, and who've been locked in a rivalry for decades. One of them finds a way to quickly mine Illyrion (very rare) in a most dangerous fashion and assembles a motley crew and tries to mine it. All the while his rival tries to stop him.<br/><br/>On the outside it's a well-known story but there's a lot of ""meta"" in this to make it more interesting, such as Katin's plan to write a novel about their adventure, and how much it resembles the quest for the Holy Grail; there is an interesting beginning of a philosophy of labor which builds up on Marx's theory of alienation (in this case represented by some philosopher from ""our"" future) and ""solves"" it using technology; and some reflections on art. Looking at Delany's life it's like the Mouse and Katlin are both facets of Delany's personality (but I'm just guessing). <br/><br/>The large involvement of reading Tarot cards in this particular society may be a product of the 70s.<br/><br/>Recommended for fans of meta-SF"						0
633177	The Iron Dream	Norman Spinrad	Spinrad, Norman		0553252895	9780553252897	3	3.62	Spectra	Mass Market Paperback	256	1986	1972	2015/05/03	2015/04/20	meta-sf, america	meta-sf (#1), america (#32)	read	"The idea behind this is hilarious - a science-fiction pulp novel from an alternative timeline, written by an Adolf Hitler who emigrated to the United States in 1919 and became something of an underground star of the US science fiction scene, producing a fanzine, being involved in SF conventions etc.<br/><br/>It's set in a future after the ""Ancients"" (us) destroyed and irradiated most of the world with atomic bombs. It's all very ""standard"" fantasy/SF from there - the hero Fenric Jaggar, a true human with pure genes, arrives in the country of his ancestors, the ""true humans"", genetically pure etc. pp. (his father had been exiled due to ""alleged warcrimes"").  <br/><br/>The kingdom is undermined by the Dominators, mind-controlling ""unpure"" monsters, who are apparently a mix of Jews and Communists, who have been created by the atomic bombs. Of course, Jaggar turns out to be the chosen one, descendant of the pure kings, he's the only one who can wield the special weapon and he's the one who saves the kingdom etc. pp.<br/><br/>It all reads like this:<br/><br/><blockquote><br/>His face was set in a steel grimace of determination; in his blue eyes was a fierce and iron ecstasy. For an instant their eyes met and they were united in the comradely communion of battle, transfigured together in a red mist beyond time or fatigue. Through the metal of the tank, the common weapon which they shared, their souls seemed to touch and merge for an instant in the greater communion that was the racial will. All this took place in the blink of an eye; their beings were not for an instant distracted from the sacred task.<br/></blockquote><br/><br/>I tried to read it in an afternoon but it just gets too tiring, and I started to flip pages towards the last third.<br/><br/>Especially  hilarious are the introduction (""About the author"") and the afterword (""Those unfamiliar with the commercial science-fiction genre may be startled to learn that such pathological products are not that uncommon. The literature of science fiction abounds with stories of all-powerful phallic supermen, alien creatures rendered as fecal surrogates, penile totems, vaginal castration symbols (such as the monster with the many sucking mouths filled with razor-sharp teeth in Swastika), subliminally homoerotic or even pederastic relationships, and the like."") I would have preferred to have the novel itself halved and the afterword doubled in length.<br/><br/>It's a fun takedown of 60s/70s ""preachy"" fantasy and SF, like the Gor novels, or even Heinlein. I would pay good money to have Bruno Ganz reprise his role as Adolf Hitler and read a German translation of this, I would die laughing.<br/><br/><a href=""http://www.depauw.edu/sfs/backissues/1/leguin1art.htm"">Here's Ursula K. LeGuin's take on the book.</a>"						0
1101500	The Red Laugh	Leonid Andreyev	Andreyev, Leonid		1425478158	9781425478155	4	4.25	Kessinger Publishing	Paperback		2005	1904	2015/04/19	2015/04/20	novella, russia, war	novella (#3), russia (#6), war (#7)	read	"What a strange little book.<br/><br/>A collection of ""fragments"" centered around a pair of brothers. The first brother's path takes him to a nondescript war, which reads more like a fever nightmare without sense or purpose. Soldiers march on without sense or purpose, people fall to the side and die, no-one knows what's going on, enemy soldiers are rarely encountered, soldiers are shot from seemingly nowhere, the skies are drenched in red.<br/><br/>He loses his legs in what may or may not be a friendly fire incident, after which he returns home to his family and brother. His shaking implies shell-shock, and he subsequently loses his mind. The other brother is not a soldier (for some reason), his story is about the reactions of society to the war, the stupidity and craziness of the people supporting it, and the madness of it all.<br/><br/>The descriptions of war - trenches, senseless shelling, fields filled with dead and wounded - made me think the author was a veteran of WW1, but The Red Laugh was published in 1904. What a strange book."						0
4982	The Sirens of Titan	Kurt Vonnegut	Vonnegut, Kurt		1857988841	9781857988840	2	4.14	Gollancz	Paperback	224	1999	1959	2015/04/18	2015/04/18	sci-fi, america	sci-fi (#36), america (#29)	read	I'm not sure why, but this left me completely cold.						0
57240	The Strange Case of the Spotted Mice: And Other Classic Essays on Science	Peter Medawar	Medawar, Peter	Rodger Jackman, Stephen Jay Gould	019286193X	9780192861931	3	3.64	Oxford University Press, USA	Paperback	256	1996	1996	2015/05/04	2015/04/15	non-fiction, philosophy-of-science, essays	non-fiction (#61), philosophy-of-science (#4), essays (#7)	read	"A range of essays - some are book reviews, which are a delight to read, very British in humor, witty, and usually fair. The only problem with them is that the book they are reviewing is usually outdated, or even out of print. The <a href=""http://www.nybooks.com/articles/archives/1976/apr/15/the-strange-case-of-the-spotted-mice/"">titular essay</a> is a review of a book on a case of scientific fraud of the 70s (the book, again, is out of print). It surprised me how many similarities there are in this case to the recent acid-bath stem cell case of fraud, and I wonder how much of the psychology Medawar mentioned can be applied in this case, too...<br/><br/>The ones on philosophy of science seem to be almost 100% based on Popper's work, these are usually rejections of inductivism and praise of falsification, there's even a short essay on why historicism is bad. I'm not sure why you should read these - they're more readable introductions to Popper's work, but if you've read Popper (or of Popper) before, you won't find that much new in these essays.<br/><br/>You can clearly see why Gould wrote the introduction for this, this is where Gould's writing is coming from (even though Gould's essay style was much different, more American).<br/><br/>The later essays are more personal, focusing on disease, a few good tips on being in a hospital, (from which I loved this quote:<br/><br/><blockquote><br/>It is a rightly humiliating thought that, in spite of Man's ability to reach the moon, etc., etc., [sic], no one has yet designed a bedpan which is not physiologically inept, uncomfortable, and somewhat obscene.<br/></blockquote><br/><br/>Absolute truth - if you've ever been in a hospital and not allowed to get up, the design of any of these things hasn't changed in more than 50 years! Here's something for your ""disrupting start up""), and on religion. These are usually short, but playful, I'd read these on their own.<br/><br/>Recommended for: Fans of scientific essays, philosophy of science pre-Feyerabend"						0
129494	The Greek Way	Edith Hamilton	Hamilton, Edith		0393310779	9780393310771	4	3.92	W. W. Norton & Company	Paperback	272	1993	1930	2015/04/14	2015/04/08	greece	greece (#1)	read	"A love letter to Greece and Greek thought, you can really feel how much Hamilton was in love with Greek. To her, the Greeks were the first to bring ""light"" into the darkness of a world ruled by darkness and magic, in the form of rational thought. The Greeks were the first to play - she compares them to the Egyptians, to whom life was just suffering. Their statues, their architecture, their poetry and writing was reduced down to the barest possible; if you've said it as precise as possible, then that's enough, no need for repetition or fancy allusions. A few playwrights are given their own chapters, in which they are compared to their ""modern"" partner (if one exists). <br/><br/>To Hamilton, Greeks were the first and the last to be truly in love with knowledge and all possible viewpoints - she gives the example that there were plays making fun of their own side during the war, which received rave reviews and full theaters. Can you imagine the same thing happen in the US nowadays [1]? Of course, it feels like sometimes her image of Greece is <i>too positive</i>, and the darker times of Athens' hubris and fall are often quickly glossed over. Then again, why focus on the ugly when you're writing a love letter?<br/><br/>Recommended for those people who'd like to know why many still see Greek philosophy, thinking and art as important.<br/><br/>[1] Her example is from WW1. But I switched for a modern example (the proof is easier to find: <a href=""http://www.alternet.org/tea-party-and-right/cut-her-head-shocking-death-threats-you-can-receive-mocking-eastwoods-american"">cough, cough</a>). Of course that comparison is unfair - Athens was small and (relatively) homogeneous in thought, the US is a huge country full of different cultures and diametrically opposed political streams."						0
19450655	Der Hundertjährige Krieg (German Edition)	Joachim Ehlers	Ehlers, Joachim				3	3	C. H. Beck	Kindle Edition	127	2012	2012	2015/04/08	2015/04/08	non-fiction	non-fiction (#56)	read	"Good, detailed, and short overview of the Hundred Years' War between the UK and France (that one with Jeanne d'Arc and <a href=""http://www.harkavagrant.com/index.php?id=353"">Edward the Black Prince</a>). My head started to swim a few times from all the names, the intricate and complicated patterns of relationships between these names and all the mini-battlefields and different motives. Makes you wonder why there are still monarchists around - would they prefer to live in a world at constant war because yet another 16th degree cousin from the king's cook stumbled upon some soldiers and thinks he's entitled to the crown?<br/><br/>Especially the last chapter is good, in which the author traces all of the societal changes (like the fall of nobelty into poverty (most sons dead, paying for ransom of the few surviving ones, etc.), the absolutist concentration of French power onto the crown etc.) brought on by the war.<br/><br/>Assassinations! Wars! Intrigues! It's like reading a 120 pages summary of Game Of Thrones.<br/>(The House of Lancaster played a prominent role in this conflict, and the following <a href=""http://en.wikipedia.org/wiki/Wars_of_the_Roses"">War Of The Roses</a> was the basis for Game Of Thrones)"						0
23522	Mythology	Edith Hamilton	Hamilton, Edith	Steele Savage	0316341517	9780316341516	3	3.98	Back Bay Books	Paperback	497	1998	1942	2015/04/06	2015/04/03	non-fiction	non-fiction (#55)	read	"A good overview of the basic ""stories"" of Western mythology - mostly Greek, some Roman stories, and a little bit on Norse mythology. It's a basic introduction - each ""story"" from Ovid, Homer, Sophocles etc. gets a few pages of summary written in a lively and opinionated style (Hamilton does not like Hera). Nothing more, nothing less."						0
18953985	The Expedition of Cyrus (Oxford World's Classics)	Robin A.H. Waterfield	Waterfield, Robin A.H.	Tim Rood		9780191605048	4	4.14	OUP Oxford	Kindle Edition	275	2005	2005	2015/03/24	2015/03/24	greek	greek (#2)	read							0
571938	Woyzeck	Georg Büchner	Büchner, Georg		3150180074	9783150180075	4	3.4	Reclam	Paperback	210	1998	1837	2015/03/13	2015/03/14	german, play	german (#10), play (#4)	read	"Everything from Büchner's earlier works is here, and in a much more mature and complete form: social injustice, critique of social structures and something like the ""Prussian mentality"", mental illness [1], satire of the higher echelons of society, futility of life... It's a shame this was never completely finished.<br/><br/>And so ends the month in which I tried to read everything from Büchner, not exactly hard since there's so little left.<br/><br/>[1] Woyzeck believes in a hollow earth and in a Freemason conspiracy, he'd have loved Youtube"						0
1690781	Leonce und Lena	Georg Büchner	Büchner, Georg		342302643X	9783423026437	3	3.54	DTV	Paperback	100	1998	1836	2015/03/09	2015/03/10	german, play	german (#9), play (#3)	read	"Alternative title: Weltschmerz is stupid<br/><br/>Very short, fun play, on the surface it's a romantic comedy, underneath, it's making fun of pretty much everything. The king is an idiotic fool who sets his own mood by edicts (""Let it be known that today I shall be happy"", loose translation from me). Leonce is a failed romantic, he tries to kill himself only to be stopped by his servant Valerio, for which Leonce berates him that it would have been such a <i>beautiful</i> suicide and now he ruined the moment. Lena, who's an ""honest"" romantic, she doesn't try to kill herself, she just wants to run away. And of course, since this is making fun of German Romanticism, all the improbable ""romantic"" things happen all of the time.<br/><br/>I don't know how well this fares in English translations, half of the dialogue is amazing Wortwitz<br/><br/>Recommended for: People who think that Werther was alright"						0
1210404	Lenz	Georg Büchner	Büchner, Georg		3150079551	9783150079553	3	3.62		Paperback	62	1986	1835	2015/03/02	2015/03/03	german, mental-illness	german (#8), mental-illness (#3)	read	"A wonderful incomplete novella - the nature descriptions start it off like a ""classic"" German romantic novel, then it turns very modern in its description of the deteriorating mental status of Lenz. It's great how the narration is in third person but is still influenced by Lenz' mental status due to paranoid schizophrenia - for example, when he doesn't know what he's doing and loses his memory, the narration skips to afterwards. <br/>Sadly we will never know what happens to Lenz in the end as this is incomplete, but everything that needed to be said has been said."						0
25200	Silence	Shūsaku Endō	Endō, Shūsaku	William Johnston	0800871863	9780800871864	4	4.08	Taplinger Publishing Company	Paperback	201	1980	1966	2015/03/13	2015/03/01			read	What a heavy, heavy book.						0
8846471	Schuld	Ferdinand von Schirach	Schirach, Ferdinand von		3492054226	9783492054225	4	3.93	Piper	Hardcover	200	2010	2010	2015/02/22	2015/02/23	crime, german	crime (#6), german (#7)	read	"Published in English together with ""Verbrechen"" as <a href=""https://www.goodreads.com/book/show/13075697-crime-and-guilt"">""Crime and Guilt""</a><br/><br/>A short book of dark stories centered around the German justice system written by a defense attorney, supposedly a mix of fact and fiction. Written in a sparse, non-judgmental, highly controlled style, he lists the facts of each case, and then towards the end the narrator appears as the lawyer who tries to sort out the case as much as possible. <br/><br/>Since this isn't TV crime many cases are never ""solved"" or really finished - for example, the first story of a masked band gang-raping a waitress ends in freedom for all of the accused: everybody wore a mask and DNA-evidence did not exist yet, the victim cannot identify anyone for sure. The story ends with the grief of the victim's family, and the lawyer having lost his youthful innocence.<br/><br/>It's very dark and certainly not for everyone, there are rarely happy ends here."						0
11887020	American Sniper	Chris Kyle	Kyle, Chris	Scott McEwen, Jim DeFelice	0062107062	9780062107060	2	3.97	HarperCollins	Paperback	528	2012	2011	2015/02/14	2015/02/14	non-fiction, america, war	non-fiction (#52), america (#28), war (#6)	read	"Written in a very simple style, here are some loose episodes told by a US sniper mostly stationed in Iraq. I honestly wonder who thought this would make a good movie, there is not much depth, and the writing is clearly influenced by action movies (biggest cringe quote: ""I managed to slip as well. My elbow flew out and landed straight on his face. A couple of times."").<br/><br/>It often reminded me of Jünger's Storm of Steel in his relatively ""pro-war"" message, like Jünger Kyle clearly enjoyed doing what he did. But unlike Jünger, Kyle has a weirdly inconsistent world-view, he sees himself as a patriot who defends his country, not for religious reasons (but then he gets the crusader cross tattooed anyway), yet Iraqis defending their country/way of life are not soldiers, they are ""savages"", ""drugged crazies"" or ""terrorists"", never soldiers.<br/><br/>It's all very American - there's no gray zone, the others are ""evil"", you're the ""good guys"", there is no moral ambiguity, life as an action movie.<br/><br/>It makes little sense. Works well as recruiting material, I guess?<br/><br/>But: the parts detailing loss of colleagues/co-soldiers/brothers were touching.  "						0
12035807	Amsterdam Stories	Nescio	Nescio, Nescio	Damion Searls, Joseph O'Neill	1590174925	9781590174920	4	3.91	NYRB Classics	Paperback	176	2012	1915	2015/02/14	2015/02/14	fiction, netherlands	fiction (#3), netherlands (#1)	read	"Read this on the train to Amsterdam, but it's not really about Amsterdam, more about growing older. The tone and atmosphere reminds me of Hard Rain Falling or Stoner, a melancholy caused by the inevitability of having to face what happened to your failed dreams when growing up. <br/><br/>Most stories focus on a group of friends from the Netherlands, they want to be artists and despise the bourgeoisie, but it's the Netherlands [1], it's small and focuses on the ""respectable"" people, the middle class. The group of friends grows older, no-one is really successful despite their high opinions of themselves, most of them have to work low-level office jobs to make ends meet (except for Jupi, the last <a href=""http://en.wikipedia.org/wiki/Larrikin"">larrikin</a>).<br/><br/><blockquote><br/>Everything went so differently from how we thought. That the world didn't care much about us - we all understood that a long time ago. But we still thought, for a while longer, that it was up to us to make the silent course of things take their course.<br/></blockquote><br/><br/>Highly recommended.<br/><br/>[1] I find the Netherlands to be more confusing than Japan. What's up with these huge ground-floor living room windows where you can see everything from everyone? And how come no-one is ever in these living rooms? And these living rooms are so spotless you could operate in there? Is there a second ""real"" living room in the basement where people actually hang out? Why are the Flodders so great?<br/>"						0
