11290708	What It is Like to Go to War	Karl Marlantes	Marlantes, Karl		0802119921	9780802119926	4	3.91	Atlantic Monthly Press	Hardcover	257	2011	2011	2013/11/25	2013/11/22	war, america, autobiography, non-fiction	war (#1), america (#9), autobiography (#5), non-fiction (#26)	read	"When it came time to get drafted into the German army I wrote a nice letter saying that war is crap and I'd never touch a weapon in order to get out of the army (and into the civil service). As such, I assumed I wouldn't connect with this book as I personally had no clue about what war's like, and after reading I'm pretty sure I'm not the target audience at all, but it was still so <i>interesting</i>.<br/><br/>It's a surprisingly spiritual book about how the US treats its soldiers, how soldiers see themselves and how soldiers are mistreated, based on Marlantes experiences in the Vietnam war. The book draws a lot from Joseph Campbell's stuff on myths and symbolism (Campbell appears several times in the book) but most of it you can still see as just being symbolic - just because Marlantes talks about the god Mars doesn't mean he himself believes that such a god exists, it's just his way to explain the ""inner warrior"". I guess it's geared towards the US public and towards decision makers - war is exhilarating which is a taboo to talk about, but it's also terrible to see your friends die, and for Marlantes there are simply not enough rituals inside the army and for returning veterans to help them cope in order to get back into society.<br/><br/>It's one of the more brutally honest books I've read about war.<br/><br/>The only drawbacks: sometimes the spiritualism is <i>too</i> heavy handed for me, and sometimes it falls into really antiquated gender roles (no wonder when you base it on ""gods"" or a symbol of those - fertility gods are female, war gods are male)."						0
1769076	Die Wahlverwandtschaften	Johann Wolfgang von Goethe	Goethe, Johann Wolfgang von		3150078350	9783150078358	3	3.73	Reclam Verlag	Paperback	269	1949	1809	2013/11/25	2013/11/22	german	german (#2)	read	This is surprisingly good - rare to see a book this full of symbolism and foreshadowing. The only problem is that these parts are excruciatingly <i>boring</i> - the first quarter of the book is literally nothing but rich people customizing their garden (with added symbolism), then it becomes interesting once the despair sets in, only to get back to people standing around simulating old pictures (which goes on for <i>way</i> too long), then it gets interesting again.<br/><br/>Goethe was great at characterization without judging - especially Eduard (the ~40 year old main guy) comes off as a spoiled child, but Goethe doesn't beat the reader over the head with it. Of course he then falls in love with the childish girl.<br/><br/>And it's fun to see how many commas fit into a sentence in German, the average must be around 8.<br/><br/>						0
17139513	The Unwinding: An Inner History of the New America	George Packer	Packer, George		1466836954	9781466836952	5	4.07	Farrar, Straus and Giroux	ebook	448	2013	2013	2014/09/18	2013/11/20	america, biography, non-fiction	america (#21), biography (#14), non-fiction (#46)	read	A depressing summary of the 'death by a thousand cuts' of US society, from the beginning of the death of the manufacturing industry, to the housing bubble, to the global financial crisis, to Occupy Wall Street. Luckily it's not a dry manifesto - it's rather three stories of 'normal' Americans interwoven in chapters, together with single chapters on various Americans who had a part, or are symbolic of, the unwinding of America and its social structures [1].<br/><br/>It's a good warning for other countries - Australia's housing boom is less like a gold-rush, but similarly unmaintainable [2], politicians all over the world (for example, the FDP in Germany) want to remove even more restrictions on finance. Nothing has changed for the US, more financial crises are coming. It's a depressing, but important book.<br/><br/>[1] The guy trying for decades to convert seed oil into Biodiesel makes me happy to work in <i>Brassica</i> genomics <br/>[2] I once lived in one of these weird American-style exurbs in Australia. Copy-pasted townhouses from my house to the horizon, no social life, no city centre except a huge plastic shopping centre, no neighbours to see, no-one walking on the streets, it's depressing and feels more like Mars than Earth.						0
87280	Too Loud a Solitude	Bohumil Hrabal	Hrabal, Bohumil		0349102627	9780349102627	4	4.2	Abacus	Paperback	98	2007	1976	2013/11/20	2013/11/20			read	A beautiful little gem of a book, based on the religious love for all kinds of literature. Read it, it just takes 2 hours. And then re-read it.						0
524005	Ambient	Jack Womack	Womack, Jack		0802134947	9780802134943	3	3.88	Grove Press	Paperback	259	1997	1987	2014/12/03	2013/11/18	cyberpunk	cyberpunk (#2)	read							0
82660	Tonio Kröger	Thomas Mann	Mann, Thomas	J. White	185399345X	9781853993459	3	3.74	Bristol Classical Press	Paperback	67	2013	1903	2013/11/19	2013/11/18	german	german (#1)	read	I missed these long, sprawling sentences						0
17674969	Life at the Speed of Light: From the Double Helix to the Dawn of Digital Life	J. Craig Venter	Venter, J. Craig		0670025402	9780670025404	4	3.83	Viking	Hardcover	240	2013	2013	2015/03/02	2013/11/10	biology, non-fiction	biology (#12), non-fiction (#53)	read	A history of modern genomics with a foray into a relatively new field, synthetic biology, here Venter summarizes his work on microbial genomes, later on the human genome and on creating new life out of existing microbes. He's a great writer when it comes to scientific details, I wouldn't hesitate to recommend this book to high school students interested in going into the field, or lay people interested in recent developments. Did you know Venter was involved in the development of Expressed Sequence Tags (ESTs)? I didn't, and yet I used them in my BSc-thesis!<br/><br/>Some people (Creationists?) might be put off by his very mechanistic view, proteins are machines, DNA is software, cells are assembly lines. I'm not.						0
18699139	Intuitive Biostatistics: A Nonmathematical Guide to Statistical Thinking	Harvey Motulsky	Motulsky, Harvey		0199946647	9780199946648	5	4.1	Oxford University Press, USA	Paperback	540	2013	1995	2014/03/10	2013/11/02	non-fiction, mathematics	non-fiction (#33), mathematics (#1)	read	"I think that when I took stats during my university courses, the focus was all wrong. It was like this:<br/><br/>here are some numbers, put them into the formula for the t-test, when the number that comes out is below 0.05 write ""I reject the Null Hypothesis with a p-value of X"". I never really learned about the basic assumptions behind this test (and all the other ones), nor did I learn about how to interpret and actually <i>think</i> about these results. Did I make mistakes in my analysis? What are possible mistakes? What could I do better? <i>What did I actually do there?</i><br/><br/>Here's a great book for exactly that set of problems - it starts off with an introduction and explanation of all the basic words and teachings of statistics (p-values, cutoffs, etc.), then goes to the basic tests (t-test, non-parametric tests, ANOVA etc.).. each method isn't introduced from the math angle, in fact the book has maybe 5 to 10 formulas, but lists the basic assumptions of the method and what you can glance from the results.<br/><br/>One caveat: Like most statisticians, Motulsky has opinions: 95% CIs are more intuitive to understand than t-tests, basing analyses on smoothed data is crap, etc. Might not be everyone's cup of tea. Motulsky also the author of the GraphPrism software for statistical analysis so that one's frequently featured (example: ""I made this analysis using Graphpad.""). To make up for that, there's an appendix on R and Excel.<br/><br/>Can a book be bad that features 4 or 5 XKCD comics? Can a book be bad when the author trawls amazon.com and writes <a href=""http://www.amazon.com/Studyguide-Intuitive-Biostatistics-Nonmathematical-Statistical/dp/1478497548"">bad reviews for fraudulent study guides</a>? Or who writes rad reviews <a href=""http://www.amazon.com/review/R2KXEUXCLKIZ04/ref=cm_cr_dp_cmt?ie=UTF8&ASIN=B0002VS8UQ&channel=detail-glance&nodeID=468642&store=videogames#wasThisHelpful"">about Dragonball</a> (boring reality would say that this was a child of Motulsky, but <i>I want to believe</i>)? <br/><br/>Recommended for: scientists, decision makers, other people who regularly work with statistics.<br/><br/>Slightly recommended for: Students - there might be too much high-level detail and opinion in here if you need to cram for a test, there are other books for that which focus on the actual math. But if you want to work in stats later it might be a good decision to read through this book."						0
9646	Homage to Catalonia	George Orwell	Orwell, George	Lionel Trilling	0156421178	9780156421171	3	4.14	Harcourt, Inc.(Harvest Book)	Paperback	232	1980	1938	2013/11/16	2013/10/31	autobiography	autobiography (#4)	read	"More a contemporary document than a novel - mostly written because Orwell felt that the (inter)national press grossly misrepresented the civil war in Spain and he tried to contradict the general opinions of the war. Has some <i>dry</i> chapters full of acronyms (P.O.U.M, P.O.E., F.A.I. etc.), and Orwell rightfully warns the readers before these specific chapters, but contains one of the best descriptions I've ever read on what it's like being shot in the throat (""Not being in pain, I felt a vague satisfaction. This ought to please my wife, I thought; she had always wanted me to be wounded, which would save me from being killed when the great battle came etc."")<br/><br/>Guess I have to read up more on the Spanish civil war! "						0
189147	To Your Scattered Bodies Go (Riverworld, #1)	Philip José Farmer	Farmer, Philip José		0345419677	9780345419675	1	3.93	Del Rey	Paperback	220	1998	1971	2013/10/30	2013/10/27	sci-fi	sci-fi (#19)	read	"I could write a longer review about this, but for now: a prime example on ""how not to write a book""."						0
666215	How to Be Alone	Jonathan Franzen	Franzen, Jonathan		0312422164	9780312422165	2	3.61	Picador	Paperback	320	2003	2002	2013/11/06	2013/10/23	essays	essays (#3)	read	Review forthcoming if I can be bothered, nothing special or particularly interesting here						0
2657	To Kill a Mockingbird	Harper Lee	Lee, Harper		0061120081	9780061120084	5	4.23	Harper Perennial Modern Classics	Paperback	324	2006	1960	2013/10/21	2013/10/21	america	america (#6)	read	Can't believe I only read this now - definitely in my top 10-20 books. I can see why some lawyers cite Atticus as their main reason to choose that job.						0
