262762	Cultural Amnesia: Necessary Memories from History and the Arts	Clive James	James, Clive		0393061167	9780393061161	5	4.09	W. W. Norton & Company	Hardcover	876	2007	2007	2014/07/09	2014/06/18	autobiography, biography, essays, on-writing, on-living	autobiography (#9), biography (#10), essays (#5), on-writing (#2), on-living (#4)	read	Oh, what a book.<br/><br/>James (who I'd never heard of before) summarizes a lifetime of reading, and note-taking, and it's essay-sized fireworks for 800+ pages. He usually starts off with a mini-biography of the essay's namesake, only then to go wherever the links take him - reading these essays feels like talking to someone who's in love with his work. 'This guy wrote some of the greatest essays ever, oh by the way if you like him there's this half-forgotten contemporary artist whose arias you should listen to, did I tell you I once met his cousin and we had the most wonderful discussion of Aristotle?' - this breathless love is how most of the essays are structured.<br/><br/>The essays are ordered alphabetically, James writes that this order is arbitrary, yet I can't help but think that it's no coincidence that the book ends with the essay on Stefan Zweig. The Austrian <i>Kaffeehaus</i>-culture of liberal humanism under the roof of the arts is one of the major themes of all essays. The destruction of the Austrian culture by the Austria's <i>Anschluß</i> (the word Anschluß appears at least 50 times) and the scattering of Paris' intellectuals during the German invasion, is heavily implied to be the worst thing to have happened to the European intellectual life in the last 100 years, and most of the essays focus on that particular group of people. It's a joy to read his takedown of Sartre, and his love for such greats as Polar, Camus, Chamfort, Croce, Kafka, Friedell,  Reich-Ranicki (as a German, that made me happy) is gigantic and jumps off the pages, infecting you. I've underlined so many books, it's going to be a minor chore to add them to my to-read shelf.<br/><br/>Luckily, James is also a funny writer:<br/><br/><blockquote><br/>Lysenko preached the kind of biological theories that Stalin could understand: i.e., they were poppycock.<br/></blockquote><br/><br/>Some of the essays are rather strange, in these, James just goes off the track too far. The essay on Sophie Scholl quickly morphs into one about Natalie Portman (and Portman gets way more pages, weirdly enough), the essay on Charlie Chaplin immediately turns into a lacklustre discussion of art vs. science (and I've read better things about that particular 'conflict'), one essay is a bit about how the 'degeneration' of English is bad: as a biologist, I firmly believe that people who hold beliefs like that would have stood on shore while the first reptile crawled on land, telling the reptile to 'stop degenerating'. The essay on Heinrich Heine is just an overlong negative rant about autograph seekers.<br/><br/>The worst essay is also the most Australian one, in which he rants for pages on pages on how the Afghani asylum seekers on board the Tampa bound to Australia in 2001 are just 'illegal immigrants' and 'queue jumpers', who should have just stayed in their home country until their application would have been accepted. It's especially worse because James, at that point, has spent 400 pages being in love with WW2-era intellectuals who've done nothing but 'jump queues' when they've escaped their home-country - can you imagine Einstein just sitting in Germany while the Gestapo is kicking down doors, waiting for his letter of invitation? Thomas Mann, too, was allowed into the USA without any papers, and Czechoslovakia even offered him citizenship so that he could formally immigrate.<br/><br/>Sometimes, his own character comes through too much, I think this is best exemplified by this sentence:<br/><br/><blockquote><br/>When filming in Rome, I had a jacket made by the celebrated tailor Littrico, and found out that I had the same measurements as Gorbachev: they were on file in Littrico's office.<br/></blockquote><br/><br/>To which I can only say: so what?<br/><br/>But these <i>Rohrkrepierer</i>-essays are in the tiny minority. I'd love to see a book like this on the life and work of scientists (if I remember correctly, only one of the 'good' essays has to do with science).<br/><br/>Recommended for: People who can't get enough stuff into their brain.<br/><br/>Not recommended for: People who, if they go on travelling to a beautiful country, get angry if there's a detour.<br/>						0
9515964	The Inimitable Jeeves (Jeeves, #2)	P.G. Wodehouse	Wodehouse, P.G.		0393339807	9780393339802	3	4.26	W. W. Norton & Company	Paperback	225	2011	1923	2014/06/15	2014/06/14	britain	britain (#2)	read	This is so British, in my imagination every single character was played by Stephen Fry.						0
12172	Memoirs of Hadrian	Marguerite Yourcenar	Yourcenar, Marguerite	Grace Frick	0374529264	9780374529260	4	4.24	Farrar, Straus and Giroux	Paperback	347	2005	1951	2014/09/01	2014/05/29	rome, french	rome (#1), french (#2)	read	"I can't believe someone from Belgium wrote this in 1951; feels more like actual memoirs than a fictional recollection.<br/>It starts off a bit slow (possibly just me getting used to the style), but becomes good somewhere around the middle. Amazing life and person; someone to emulate.<br/><br/>Recommended for: Fans of ancient Rome/Greece, people looking for a role model.<br/><br/>P.S.: Seems to be a famous book - weirdly enough, completely unknown in Germany, it doesn't even have a Wikipedia article in German. The new 2008 edition has the strange title ""Ich zähmte die Wölfin"", which translates to ""I tamed the wolf"" (wolf being the female form). ???"						0
10569	On Writing: A Memoir of the Craft	Stephen King	King, Stephen		0743455967	9780743455961	4	4.27	Pocket Books	Mass Market Paperback	297	2002	1999	2014/09/22	2014/05/20	on-writing	on-writing (#3)	read	Nice mini-autobiography of King, with the majority of the book focusing on tips on writing if you want to write in King's style, i.e., don't use adverbs, just write and don't plan (now I know where these endings come from), write for a specific person, etc., pp. <br/>Bonus star for being honest, King isn't the world's 'artiest' writer and he knows it.						0
774088	Difficult Conversations: How to Discuss What Matters Most	Douglas Stone	Stone, Douglas	Bruce Patton, Sheila Heen	014028852X	9780140288520	3	4	Penguin Books	Paperback	272	2000	1999	2014/06/09	2014/05/18	self-help	self-help (#1)	read	A good guide to 'difficult conversations' with boss/spouse/people, i.e., clashing stories, themes that endanger your self-image, and emotions, it contains some valuable advice on how to incorporate everyone's and your own feelings in a mature way during a conversation.<br/><br/>But: For the love of all that is holy, do not follow the advice contained in this book with children. I had teachers who went to university in the 'progressive' 70s, so what they talked about all day is your feelings and their feelings and it's all very annoying when you just want to set things on fire. The authors circumvent the issue by pretending that children don't exist. A note like 'btw, this stuff doesn't work with children' would have helped.						0
162780	What Is Life? with Mind and Matter and Autobiographical Sketches	Erwin Schrödinger	Schrödinger, Erwin	Roger Penrose	0521427088	9780521427081	4	4.1	Cambridge University Press	Paperback	194	1992	1944	2014/05/24	2014/05/14	biology, philosophy	biology (#6), philosophy (#2)	read	"What I expected:<br/><br/><img src=""http://imgs.xkcd.com/comics/physicists.png""><br/><br/><a href=""http://xkcd.com/793/"">Source</a>, CC-BY-NC 2.5<br/><br/>What I got:<br/><br/>""What is Life?"" is a surprisingly humble take on the problems biology had in the 1940s. Schrödinger tries to summarize how physics and chemistry can help solve biology's problems, like how information is actually inherited. He often comes so close to the actual truth that you want to shout at the book while reading it - I wonder what he would have done with Rosalind Franklin's X-Ray diffraction images of DNA.... <br/><br/>In other times he's a bit lost, like when he thinks that new physical laws are needed to solve the riddle of heredity; as far as I know, we didn't need to come up with new laws. I don't think that's his fault, though: he was just hypothesizing from the data available to him at that time.<br/><br/>One of the cooler concepts Schrödinger introduces is the concept of life as a system that ""eats"" entropy and thereby evades thermodynamic equilibrium, as predicted by the second law of thermodynamics.<br/><br/>The book itself is further proof that scientists never operate in an intellectual vacuum, every great discovery is based on preceeding thougts. Both Watson and Crick, the discoverers of the DNA-structure, had read the book. Without it I doubt they would have thought of the structure the way they did.<br/><br/>The second book ""Mind and Matter"" is much more philosophical in nature and concerns free will, the self and how we perceive the world. Here Schrödinger quotes Indian scripture to make his point that the subject and object are one, conciousness isn't as clear cut as people commonly believe, etc. If you're into that this part will bore you. It did, however, contain a small discussion of cultural heredity in the form of ""Mnemes"" - something which has been popularized by Dawkins in the last few decades.<br/><br/>Recommended for: Fans of science, it's so short you can read it in an afternoon. People interested in the history of science, What Is Life? is one of the most influental scientific books of the last 100 years (judging on how many scientists cite it as their prime inspiration to get into biology)."						0
91540	Kwaidan: Stories and Studies of Strange Things	Lafcadio Hearn	Hearn, Lafcadio		0804836620	9780804836623	3	3.96	Tuttle Publishing	Paperback	256	2005	1904	2014/05/14	2014/05/12	japan	japan (#4)	read	"Fun ghost stories from 1905; mostly strange to me as a European because our ""traditional"" stories always have a moral, or some point, like ""don't stray from the given path"", ""listen to your superiors"" etc. pp. Japanese ghost stories rarely have a moral, the doom brought by ghosts or spirits befalls the good and the evil alike. Karma exists but it it's more useful for reincarnation - there is no all-encompassing ""good"" like in the Christian worldview.<br/><br/>The entire folklore of Japanese yokai is fascinating, and Hearn touches on some of them, like the Yuki-Onna, but it's often feels like Hearn influences the stories too much.<br/><br/>The last few chapters are all weird, starting with an autobiographical story of Hearn that I did not particularly care for, then continuing with a strange description of Horai, a mythical Chinese and Japanese place, but the description differs from anything else in the Japanese literature and must have been mostly invented by Hearn. Sadly, this ""taints"" the other preceding stories: I can't tell whether Hearn influenced them, or if they're ""proper"" Japanese stories. <br/><br/>Even weirder is the finishing chapter with Hearn's thoughts on butterflies, mosquitoes and ants. Interestingly he described that ants keep mushrooms, I thought that was a more recent discovery.<br/><br/>Recommended for: Fans of Japan, and those who like Folklore stories. I think most people can skip the last 3 chapters."						0
7433149	I Curse the River of Time	Per Petterson	Petterson, Per	Charlotte Barslund	1555975569	9781555975562	3	3.37	Graywolf Press	Hardcover	233	2010	2008	2014/05/30	2014/05/11	scandinavian	scandinavian (#1)	read	Do you like Pink Floyd? Remember 'No one told you when to run, you missed the starting gun'? In a way, this novel's narrator completely missed the gun - he's 37, has never really connected with his family, always did what he was told.. His mother is diagnosed with cancer, in a panicky attempt he tries to reconnect with her, but she's obviously got other problems. It's a fine, quiet description of a life not really lived.  <br/><br/>So why did I give this only 3 stars? I think I'm too young for this. In 20 years, or so, this book might resonate more with me.						0
91477	Fool Moon (The Dresden Files, #2)	Jim Butcher	Butcher, Jim		0451458125	9780451458124	2	4.04	Roc	Mass Market Paperback	401	2001	2000	2014/05/05	2014/05/05	urban-fantasy	urban-fantasy (#2)	read	I liked this one even less than the first one -<br/><br/>it manages to create a fantasy-world completely devoid of wonder. When Tolkien creates the world of LOTR, he gives the reader only a glimpse of what Tolkien has built - he tells you that there are a ton of different races, but in the story not all of them appear; Tolkien tells you that all of these races have complete, twisted, intertwined back-stories, but gives you only a glimpse, as much as you need to know. Butcher, on the other hand, creates only exactly as much back story as needed - there are 3 types of werewolves, ergo all of them have to appear (however ham-fisted their inclusion in the story is [1]), he tells you all there is about them (not much) and then has all the characters act out all there is to them, nothing is left to the fog... In other words: if Butcher had directed the original Star Wars trilogy, Boba Fett wouldn't have had a helmet.<br/><br/>And, I get that most of the characters are wolves, but honestly, using 'he/she/it snarled' instead of the classic 'he said' gets tiring fast.						0
47212	Storm Front (The Dresden Files, #1)	Jim Butcher	Butcher, Jim		0451457811	9780451457813	3	4.02	Penguin ROC	Paperback	352	2000	2000	2014/05/02	2014/05/02	urban-fantasy, fantasy	urban-fantasy (#1), fantasy (#2)	read	"Takes elements from 40s and 50s noir, melts them with ""urban fantasy"", and adds some elements from the 90s RPG Arcanum, to create a wizard/private investigator who specializes on ""otherworldly"" investigations. There's of course a murder, a bit of damsel in distress, a few friends in low places, a couple of bad guys, and magic, everything you'd expect from the mix.<br/><br/>Sometimes the ""fantasy"" and the ""noir"" elements clash for the worse, Butcher has to pull some story tricks to have an overpowered wizard who's also the downbeaten looser who's in a case over his head, and it doesn't work well all the time.<br/><br/>Still, it's a fun, quick read if you want something to entertain you for an afternoon or a trainride. I might pick up all the following books, too."						0
321263	Humanity: A Moral History of the Twentieth Century	Jonathan Glover	Glover, Jonathan		0300087152	9780300087154	4	4.23	Yale University Press	Paperback	476	2001	1999	2014/06/14	2014/05/01	history	history (#2)	read	"This book summarizes the worst atrocities of the 20th century, not as some kind of freakshow, but as examples in how human psychology and ethics can be bent to enable people to commit the worst mankind has done in its 200,000 years of history. Glover doesn't offer many solutions for the future (maybe in another book?) except that we need political restraints on a world scale (but: if you have a world police, that police can kill without problems) and we need to learn how to develop ethics and psychology in the face of technology that enables us to kill men, women, children at the press of a button.<br/><br/>A few personal takeaways:<br/><br/>- People <i>actually learn from history</i>, and they actually <i>learn from books!</i> During the Cuba Missile Crisis the Soviets cited their personal war experience and Kennedy cited the First World War, especially Tuchman's <a href='https://www.goodreads.com/book/show/11366.The_Guns_of_August'>Guns of August</a>, as reasons why they did not want to continue the conflict (as a sidenote, reading the letters and opinions of the US military leaders who wanted to keep the conflict going makes you realize how realistic Jack D. Ripper in Dr. Strangelove is)<br/><br/>- History repeats itself, all the time; when the Athenians attacked the Melians, they 'presented [their] hard amoralism as mere realism'. Everyone else has done that since, here in Australia the current government clouds their inhumanity in the guise of 'adults being in charge'.<br/><br/>- In a way, the First World War was present at Nagasaki and Hiroshima. Glover makes a nice case how the 'modern' sliding of standards in regards to the death of civilians in wartime started at the blockade of Hamburg in WW1, went on to the indiscriminate bombing of civilians from Germans and the British, and culminated in the atomic bombs. If this book would have come out later it would have included indiscriminate drone killings in the Middle East in that slide.<br/><br/>- Internet trolls with absolute horrifying opinions in the comment section of news-articles are nothing new:<br/><blockquote><br/>[...] another American massacre of Japanese survivors in lifeboats provoked a letter of moral criticism, which was published. Many of the replies to that letter claimed that Japanese atrocities justified the massacre. One reader wrote of 'killing a helpless rattlesnake'. Another had 'thoroughly enjoyed' reading about the slaughter'. Another said that a 'good old American custom I would like to see is nailing a Jap hide on every ""backhouse"" door in America'.<br/></blockquote><br/><br/>- Glover doesn't like Heidegger in the slightest: 'The inarticulate complexity is Heidegger's trademark. Can someone whose thinking is so blurred be a serious philosopher?' Or even better (you have to know that Heidegger once wrote that Hitler's hands were beautiful):<br/><br/><blockquote><br/>To imagine a meeting between them, with Heidegger glancing at Hitler's marvellous hands and talking about the unity of the outside-of-itself in the raptures of the future, is to be reminded how easily the Führer was moved to rage. That the two men did not meet is one of surrealism's great losses in the twentieth century.<br/></blockquote><br/><br/>Not recommended for: <br/>1) The squeamish. Every atrocity is introduced with several personal eyewitness accounts, it makes for good nightmare material. In fact, I think I had weird nightmares every single night while reading this book (but: correlation != causation)<br/>2) People who love people, your beliefs might take a punch:<br/><blockquote><br/>The widespread enthusiasm even now for capital punishment seems to reflect something more than a concern to reduce crime rates. When capital punishment was the law in Britain, there were about five applications a week for the post of executioner.<br/></blockquote><br/><br/>Recommended for: People interested in changing the future by learning from the past."						0
2362798	One Soldier's War	Arkady Babchenko	Babchenko, Arkady	Аркадий Бабченко, Nick Allen	0802118607	9780802118608	4	4.03	Grove Press	Hardcover	395	2008	2006	2014/05/06	2014/04/29	war, russia, autobiography	war (#3), russia (#4), autobiography (#7)	read	Great account of both wars in Chechnya, from a Russian journalist who, for reasons unknown to him, volunteered for the second, and then came back as a journalist to report on Chechnya after the war (spoiler: people still die in droves, but Russia just fakes a layer of fake peace on top of reality).<br/><br/>As it's more therapy than novel the structure is 'patchy', the author wrote what he had to write, with little regard for 'setting up scene', or whether the stories are connected. Since this is reality, there is no 'red thread' going through the book - people appear, they disappear, they reappear, most of the time they die.<br/><br/>The major theme of the novel is brutality, so if you can't stomach that, stay away. In this book the Russian army has a pecking order based on sheer brutality, the new ones get beaten up by the old ones, the higher rungs beat up the lower ones, etc. - and not just a slap, but kicks in the face until teeth fall out, every night. Chechen warriors disembowel captured Russians, or publicly slit their throats. People get blown up, so that only a foot is sent home in a zinc coffin, welded shut. Mothers of missing soldiers are accidentally shot - they've come to Chechnya to find their sons, since the chaotic Russian army can't really keep track of anything. Deserters run away? Eh, so what, they'll die anyway. Newcomers steal some ammunition? The officers get drunk, beat up the newcomers brutally over days, mock-execute them, until they kick them out naked into Chechnya; left to die.<br/><br/>I can't really understand the comparison to Catch-22 in Goodreads' description - Catch-22 was an over-the-top satire which took many freedoms to get the point across, One Soldier's War is just nihilist brutality from start to end.						0
6772577	The Cleanest Race: How North Koreans See Themselves and Why It Matters	B.R.   Myers	Myers, B.R.		1933633913	9781933633916	4	3.93	Melville House	Hardcover	208	2010	2010	2014/05/01	2014/04/26	non-fiction, korea	non-fiction (#40), korea (#1)	read	<br/>This is a surprisingly interesting book - the author sets out to show that North Korea has two 'sets' of propaganda, one is mainly used internally, the other is shown to the world. The outdoor propaganda is Juche Thought, a relatively inconsistent quasi-Communist waffling no-one really bothers to understand or 'fix'. The internal propaganda (called 'the Text' in the book) is interesting - a racist national set of ideas, initially copied from the Japanese under Hirohito, and then amended over the decades. <br/><br/>The Koreans are the 'purest' people, and since they're so 'pure' they need protection from the outside world from the Dear Leader, the most Korean Korean. The Koreans are a child-like race too pure, under constant threat from  outside evils such as 'Yankees', diverse 'puppet regimes' of the Yankees like the South Koreans, and other threats to their purity. It's a little bit like North Koreans see themselves like one of these overbred dogs who can't walk up stairs on his own.<br/><br/>This is all very interesting to learn, especially as the depth of Western media's reporting on the DPRK can be summarized as 'look at these weirdos lololol here's the weather' Myers seems to have strong opinions on other Western DPRK researchers, and since I know very little about North Koreans, I can't judge how accurate he is. In fact, if what this book says it's true, it's going to be much, much more difficult to change the political situation in North Korea than it was in East Germany - East Germans saw the economical success of West Germany and wanted the same which was one of the factors leading to collapse, North Korea sees the economical success of South Korea and treats it as a sign of their 'unpure' depravity. Even if the military leadership is replaced or eliminated like in Iraq, people won't be cheering - you can't just replace an entire mythology, taught over 50 years, over night and think people will accept you.<br/><br/>Sadly this book is a bit short, and was published before Kim Jong-un became leader/president/head honcho. I would've liked to read what Myers thinks of Kim Jong-un - he certainly seems to portray the 'child-like' in the North Korean mythology very well [1]. As a biologist, I would have also liked to read more about the 'scientific' side of the racist myth, since the Soviet Union had their own science (Lysenkoism) and ran experiments etc. Does that scientific side even exist?<br/><br/>Bonus fact: You can read this book pretending it's about an alien race on Venus and it still works!<br/><br/>Recommended for: People interested in authoritarian regimes, different ways to view the world, Korea, communism, and those who like to read excerpts from strange, alien novels.<br/><br/>Not recommended for: People who like to cling to their belief that North Korea is led by a bunch of bumbling fools.<br/><br/>[1] Seriously, on all official pictures he looks like a fat baby.						0
23814	King Solomon's Mines (Allan Quatermain, #1)	H. Rider Haggard	Haggard, H. Rider		0812966295	9780812966299	2	3.78	Modern Library	Paperback	264	2002	1885	2014/04/26	2014/04/25	adventure	adventure (#4)	read	"Not much to say about this one - a quick read if you want to have something ""adventurous"", think Indiana Jones or Karl May, but nothing special or spectacular. Weird and racist treatment of Africans, especially the way the translated dialogue is always presented in this fake Old English language (thine/doth/etc.), they're all ""noble savages"", whites and blacks shouldn't 'mix' etc. pp. <br/><br/>Recommended for: 12 year old boys, might make a good introduction to reading (but there are better alternatives, like Treasure Island)"						0
