6346975	Moonwalking with Einstein: The Art and Science of Remembering Everything	Joshua Foer	Foer, Joshua		159420229X	9781594202292	4	3.81	Penguin Press HC, The	Hardcover	307	2011	2011	2013/06/03	2013/05/26	non-fiction, memory	non-fiction (#10), memory (#1)	read	This is one of the autobiographic non-fiction books in which the author tries something crazy and writes a book about the experience - similar to 'Reading the OED' or 'The Year of Living Biblically'. <br/><br/>In this case, Foer decides to become a memory champion in order to compete at the US championship. Along the way he learns the memory tricks that are mostly based on the Greeks' work but are still widely in use today, and uses the opportunity to write about the history of memory, some extremely interesting edge cases (like the guy who inspired Rainman), some of the science behind remembering, how these techniques are having a small renaissance in teaching, and why it is that we can remember some things better than others (for example, spatial memories are easier and faster to remember than numbers). You'll learn that memory champions are not hyper-intelligent <i>savants</i>, but are just people who are well-trained in a specific set of tricks, similar to good magicians (a comparison Foer repeats at least 3 times).<br/><br/>Of course, reading this book won't turn you into a all-remembering memory beast, for these tricks require too much initial work - for example, to remember a deck of cards you first have to remember a vibrant (if possible raunchy) image to connect the card to, so you don't have to remember the card itself, only the image. Coming up with these images in the first place, and subsequently learning them for an entire deck of cards, already takes several days to weeks. And then you're in possession of one of the more useless tricks in the world, congratulations.<br/><br/>And of course, there's one small story at the end to prove that when you're the memory champion you don't have to have a good memory: When Foer returns from the US championship, he drives his car to a restaurant to have dinner with friends. Later he returns home by tram, only to realize at home that he forgot he had a car.<br/><br/>Recommended for: People who always wondered what it would be like to know more than 3 digits of Pi. People who constantly wonder where their car-keys are.						0
49221	A Grief Observed	C.S. Lewis	Lewis, C.S.		0060652381	9780060652388	5	4.24	HarperOne	Paperback	112	2009	1961	2013/06/25	2013/05/23	non-fiction, on-death, christianity	non-fiction (#12), on-death (#1), christianity (#1)	read	"Wow, what a book. The background: Lewis met Joy Davidman in life after she came to the UK to separate from her alcoholic/abusive husband. They became friends (""For Jack the attraction was at first undoubtedly intellectual. Joy was the only woman whom he had met ... who had a brain which matched his own in suppleness, in width of interest, and in analytical grasp, and above all in humour and a sense of fun.""), and, after she was diagnosed with terminal cancer, they married in 1956. After a brief relapse she died in 1960. <br/><br/>This very short book is Lewis' way of trying to come to terms with his grief - it's painfully and brutally honest with himself and his confusion about his beliefs. He tries to understand his grief, he tries to understand to position the grief with his beliefs, and eventually he slightly comes to terms with it.<br/><br/><blockquote><br/>The conclusion I dread is not 'So there's no God after all,' but 'So this is what God's really like. Deceive yourself no longer.'<br/></blockquote><br/><br/>or this one:<br/><br/><blockquote><br/>But go to Him when your need is desperate, when all other help is vain, and what do you find? A door slammed into your face, and a sound of bolting and double bolting on the inside.<br/></blockquote><br/><br/>When he remembers her and tries to explain the amount of grief he's suffering and tries to come to terms with his grief, that's when <i>someone's</i> cutting onions around you:<br/><br/><blockquote><br/>Her absence is no more emphatic in those places than anywhere else. It's not local at all. I suppose that if one were forbidden all salt one wouldn't notice much more in any one food than in another. Eating in general would be different, every day, at every meal. It is like that. The act of living is different all through. Her absence is like the sky, spread over everything.<br/></blockquote><br/><br/>or <br/><br/><blockquote><br/>I have always been able to pray for the other dead, and I still do, with some confidence. But when I try to pray for H., I halt.<br/></blockquote><br/><br/>or <br/><br/><blockquote><br/>Reality, looked at steadily, is unbearable.<br/></blockquote><br/><br/>It's one of the saddest books I've ever read, since it's absolute naked truth.<br/><br/>Recommended for: people who have lost someone.<br/><br/>Not recommended for: Invincible heartless space robots with rockets for feelings"						0
222146	Masters of Doom: How Two Guys Created an Empire and Transformed Pop Culture	David Kushner	Kushner, David		0812972155	9780812972153	4	4.26	Random House Trade	Paperback	339	2004	2003	2013/11/11	2013/05/21	america, biography, games	america (#8), biography (#7), games (#1)	read	"A fun book, and very well researched (several hundreds of interviews went into this one), but I can't vouch for its authenticity since I have no clue.<br/><br/>I grew up with Carmack's and Romero's games, getting my first PC (a 386 with 16 MHz and a fancy turbo-button for a <i>blindingly fast</i> 33 MHz) in 1994 was right at the height of their career - I had most Commander Keen parts, and until this book I didn't even know they were basically the start of the career of ""the two Johns"", both having created Commander Keen as the first game that allowed side-scrolling on the PC. Of course, later I had Quake and Doom... and once I had a state-of-the-art 3dfx Voodoo 3 graphics card I could even play Half-Life! (or rather, Counter-Strike Beta 4). As you can see, this book makes you nostalgic.<br/><br/>The book stops somewhere around the release of Doom 3, and on a positive note. But it's fun to see that the ""tinkerer""-side of Carmack, someone who was always trying to be on the forefront of graphical development, is still going strong - he recently became CTO of Oculus, a company that creates new virtual reality helmets.<br/><br/>The only minor annoyance to me is a bit unfair towards the book: since I now developed a bit of a fancy for algorithms, it would have been nice to read more about these, or even how Carmack was able to keep up to date with what research was pumping out in his field (the book glances over technical details for better readability).<br/><br/>I guess there are two camps as the audience of this book - one is people who grew up with PC-gaming in the 90s, and the other is people who are into startup-stories or business stories in general; I guess some cautionary tales can be learned from id software's terrible atmosphere and Ion Storm's failure."						0
14185	The Three Stigmata of Palmer Eldritch	Philip K. Dick	Dick, Philip K.			9781407247427	4	4	Gollancz	Paperback	231	2010	1965	2013/06/21	2013/05/21	sci-fi, weird	sci-fi (#13), weird (#2)	read	Lots of PKD's common themes in this - reality is a construct built by our minds, so it's only logical that drugs change reality, including the reality of people who've never taken drugs (similar themes are present in PKD's <i>Flow My Tears, the Policeman said</i> as well as in <i>A Scanner Darkly</i>).<br/><br/>However, this book draws much more from metaphysics and religion, as you probably can guess from the title. The antagonist (?) Palmer Eldritch becomes some sort of demi-God for all those partaking in his drug Chew-Z - users are transported to some kind of shared mass-fantasy in which Palmer Eldritch appears. In a way, <i>The Three Stigmata</i> is a lot like PKD's <i>VALIS</i> - it's interesting to read  and at some point it's tripping balls, but you also lose the sense of what on earth's going on.						0
40445	Altered Carbon (Takeshi Kovacs, #1)	Richard K. Morgan	Morgan, Richard K.		0345457692	9780345457691	3	4.1	Del Rey Books	Mass Market Paperback	526	2006	2002	2013/05/24	2013/05/20	cyberpunk	cyberpunk (#1)	read	Starts out as Shadowrun/Neuromancer mash-up (Japanese megacorps! Runs! Violence!), then becomes a suspenseful noir Cyberpunk thriller - recommended. I am looking forward to this novel becoming outdated.						0
6748	A Supposedly Fun Thing I'll Never Do Again:  Essays and Arguments	David Foster Wallace	Wallace, David Foster		0316925284	9780316925280	4	4.27	Back Bay Books	Paperback	353	1998	1996	2013/06/14	2013/05/20	essays, non-fiction	essays (#1), non-fiction (#11)	read							0
7036409	How Learning Works: Seven Research-Based Principles for Smart Teaching	Susan A. Ambrose	Ambrose, Susan A.	Marsha C. Lovett, Richard E. Mayer, Michael W. Bridges, Michele DiPietro, Marie K. Norman	0470484101	9780470484104	4	4	Jossey-Bass	Hardcover	301	2010	2010	2014/07/01	2013/05/18	non-fiction	non-fiction (#43)	read	"A good non-fiction book clearly targeted towards those who teach adults like university professors, it collects in 7 chapters problems professors face in their teaching - each chapter starts with two small stories of teaching frustration, goes over to what underlies these problems with students, summarizes the peer-reviewed literature, and shows ways for teachers to alleviate the problem in question.<br/><br/>It's no wonder that organizations like Software Carpentry chose this book for their instructors, it's a great crash-course on how to be a better teacher. If I ever wind up teaching at a university (stranger things have happened) I will be ""borrowring"" from the appendix of this book with useful templates for feedback etc., and I will have to re-read the entire book, again. It's not that long anyway.<br/><br/>Reading through the chapters I couldn't help but be reminded of my terrible high school years and how the teachers seemed to have actively tried to do everything wrong, with no feedback, one big evaluation at the end of the year instead of small ones, terrible classroom atmosphere, no defined goal of learning, no rubrics, and on and on and on.<br/><br/>I would love to read the same book, but with a different target audience - a book that takes all this peer-reviewed, published and established knowledge about learning and bundles it into a manual on how to learn and study ""the best"" way(s). It would have helped tremendeously in my high school and university years.<br/><br/>Recommended for: Those who teach, and those who like to learn by themselves and would like to learn more efficiently."						0
19494	The Spy Who Came In from the Cold	John le Carré	Carré, John le			9780743442534	3	4.01	Scribner	Paperback	224	2001	1960	2013/05/18	2013/05/18	spies, cold-war	spies (#1), cold-war (#1)	read							0
11746626	The Art of R Programming: A Tour of Statistical Software Design	Norman Matloff	Matloff, Norman		1593273843	9781593273842	4	4.05	No Starch Press	Paperback	400	2011	2011	2014/01/11	2013/05/15	programming	programming (#1)	read	"If you're looking for a book to read as a full-on introduction to R (and advanced R), take this book. <br/>Not only does it go through all of the basics of the language, it also recommends some modern packages which make everything easier (plyr for example) - with copious examples and ""advanced examples"".<br/><br/>I only have two problems with the book:<br/><br/>1) Sometimes, the advanced examples are too clever for their own good. They're meant to exhibit the advanced usage of the main focus of the current chapter, but they so often do something exceedingly clever that you first have to go through the code step by step with a piece of paper to understand the basic algorithm. Only then can you go on and understand the usage of the data-structure or control-structure in question.<br/>2) It can't decide whether it's an introduction or a reference. The book is written and structured like an introduction, but it seems to be on a quest to introduce the majority of standard functions that R has (and they are legion). I'm pretty sure I already forgot about 80% of the introduced functions."						0
226378	A Hero of Our Time	Mikhail Lermontov	Lermontov, Mikhail	Paul Foote	014044176X	9780140441765	4	4.1	Penguin Classics	Paperback	185	1966	1839	2014/07/24	2013/05/12	russia, satire	russia (#5), satire (#2)	read	Interesting short psychological study - you first think Pechorin is a gigantic douche, then you learn his inner, cold, nearly psychopathic thoughts, but then he turns around and confuses you with <i>actual feelings</i>, remorse, guilt, despair - only to turn around again! You're left wondering who it is you've just read 150 pages about, and you're reminded that good characters can't be reduced to a single attribute.						0
433567	Flatland: A Romance of Many Dimensions	Edwin A. Abbott	Abbott, Edwin A.	Banesh Hoffmann	048627263X	9780486272634	5	3.8	Dover Publications, Inc.	Paperback	93	1992	1884	2013/05/13	2013/05/07	two-dimensional	two-dimensional (#1)	read	"What an amazing idea - how would life look like if there'd be no third dimension? We read of the narrator (a humble square), who describes his society & life, and how he met the glorious three-dimensional sphere who changed his life... How life works is amazingly well-thought out (though I didn't understand some points - how can there be reading and writing in a two-dimensional context? Letters need height!), some great details - for example, women are ""just"" lines, who are dangerous because they are invisible from the side...<br/><br/>Recommended for: People who like to think about how things could be."						0
8264505	Endgame: Bobby Fischer's Remarkable Rise and Fall - from America's Brightest Prodigy to the Edge of Madness	Frank Brady	Brady, Frank		0307463907	9780307463906	4	3.86	Crown	Hardcover	402	2011	2011	2013/08/05	2013/05/04	biography, non-fiction	biography (#4), non-fiction (#17)	read	"(actually 3.5 stars)<br/><br/>Details the life of Bobby Fischer in an entertaining and well-written way - you can find better summaries elsewhere. The only qualm I have is that the author, Frank Brady, has a personal connection to Fischer from Fischer's late childhood on and was deeply impressed by Fischer. <br/><br/>As such, Brady is constantly trying to improve Fischer's image and sometimes he's just trying too hard - for example, in the match Reshevsky v. Fischer (the ""Match of the Century""). Due to one of the sponsors of the match having different obligations the organizers moved the start of the match a couple of hours earlier, and Fischer just wouldn't have that. He simply didn't show up to the game and thus lost it. How does Brady describe it?<br/><br/><blockquote><br/>... the ""Match of the Century"", as it had been billed, was the unfortunate casualty of Bobby's ingrained sleep habits and the long shadow of patronage in chess.<br/></blockquote> (p. 164)<br/><br/>No, it was a casualty of Fischer being an arrogant brat!<br/><br/>Anyway, I'd still recommend it, it shows that a) behind a ""genius"" is a mountain of lonely hard work (I guess ""geniuses"" don't really exist?), and b) it's always entertaining to read about douchebags.<br/><br/>P.S.: There's also an interesting connection to the ongoing Snowden-case: When an elderly Fischer was arrested in Japan for being there illegally (his passport was revoked by the US because Fischer committed the crime of playing in the embargoed communist Yugoslavia about 10 years earlier) Iceland made Fischer an Icelandic citizen so that Japan didn't have to extradite Fischer to the US. I guess this is why so many people look to Iceland to help Snowden? But on the other hand, Fischer had prior connections to Iceland - he was seen as something of a national hero since he held a tournament in Iceland some twenty years earlier, which made Iceland internationally known. Snowden does not have any such connection."						0
88071	The Last Colony (Old Man's War #3)	John Scalzi	Scalzi, John		0765316978	9780765316974	3	4.01	Tor Books	Hardcover	320	2007	2007	2013/05/03	2013/05/02	sci-fi	sci-fi (#9)	read							0
393199	Down and Out in Paris and London	George Orwell	Orwell, George		015626224X	9780156262248	5	4.09	Mariner Books	Paperback	213	1972	1933	2013/09/30	2013/04/29	autobiography	autobiography (#2)	read	"Orwell's first novel, a semi-autobiographical description of his time in Paris as a poor dishwasher and in London and surrounding areas as a homeless tramp; it reads very destitute, and Wikipedia gives a relatively different description of that time (for example, Wikipedia says he lived with his parents, so there was always a financial backing if things became <i>too</i> tough). <br/><br/>Nevertheless, his love for humans shines through on every page; and he still manages to inject humour even when writing about the ugliest people. His descriptions and experiences living on the absolute bottom of society is where his political leanings were born - I think this is also where parts of Animal Farm and 1984 come from. <br/><br/>The book is on Gutenberg, but the <a href=""http://ebooks.adelaide.edu.au/o/orwell/george/o79d/"">ebooks@Adelaide version</a> is slightly nicer, although there's about 10-15 scanning errors."						0
194440	No Surrender: My Thirty-Year War	Hiroo Onoda	Onoda, Hiroo	Charles S. Terry	1557506639	9781557506634	3	4.1	US Naval Institute Press	Paperback	220	1999	1974	2014/06/17	2013/04/26	japan, war	japan (#5), war (#4)	read	What a strange, strange story. Onoda was trained in guerilla warfare by the Japanese army and had been sent to a small island in the Philippines to fight the war against the Americans. Unusual for Japanese soldiers, he had been explicitly forbidden from committing suicide and had been allowed to be captured. His orders were to cause mayhem until the Japanese army would sent explicit orders or would come to pick him up. That never happened, so he stayed for 30 years until a student found him in 1974.<br/><br/>The book becomes most interesting when he describes his mental acrobatics to keep on fighting - other Japanese often came looking for him, dropped leaflets on the island, called for him via speakers, but he always found some minor mistake or flaw to convince him that these people were impostors sent by the enemy to trap him. Newspapers saying that the war was lost with pictures of Japanese in their cities were obvious fakes - if Japan had lost, all Japanese people, including children and women, would have died fighting! It didn't really help either that the Philippine army used the island to train bombing runs (<i>genius</i> idea - train where you know that there are still guerillas hiding) - what would you think if you were stuck in an imagined war, but the planes dropping bombs were real? <br/><br/>He never got the official order to stand down, so he never stopped fighting, which he did by terrorizing the poor islanders, burning their rice, shooting at them, stealing from them.<br/><br/>Sadly, the autobiography is slightly insincere. Onoda describes shooting in the general direction of people and never mentions whether he actually hit someone, but <a href='http://en.wikipedia.org/wiki/Hiroo_Onoda'>Wikipedia</a> says he killed several islanders.<br/><br/>Onoda died just 5 months ago. This book seems to have been forgotten since it came out in the 70s - I got it for a dollar at the Lifeline bookfest.<br/><br/>Recommended for: 1) People who are into survivor manuals. Want to know how to store ammunition in the jungle? Collect the bullets in a glass bottle, put coconut oil on the bullet to prevent rusting, close the bottle with a steel cap to prevent rats from eating the coconut oil! <i>You're welcome!</i> (The book has helpful drawings too)<br/>2) People interested in reading about how your psychology can bend your reality<br/>						0
21611	The Forever War (The Forever War, #1)	Joe Haldeman	Haldeman, Joe		0060510862	9780060510862	4	4.13	Voyager	Paperback	278	2003	1974	2013/05/06	2013/04/25	sci-fi, classic	sci-fi (#10), classic (#1)	read							0
762476	Kokoro	Natsume Sōseki	Sōseki, Natsume	Edwin McClellan	0809260956	9780895267153	4	3.97	Gateway Editions	Paperback	248	1996	1914	2014/10/19	2013/04/12	japan	japan (#7)	read	I learned a new way to be sad!						0
194746	No Longer Human	Osamu Dazai	Dazai, Osamu	Donald Keene	0811204812	9780811204811	4	4.02	New Directions	Paperback	177	1973	1948	2013/08/20	2013/04/12	japan	japan (#2)	read	"Reminds me a LOT of Dostoevsky's Notes From Underground, except that No Longer Human actually has a plot (it includes a lot of drinking, prostitutes and suicides, but it's a story nonetheless). It's fun to see my own sociophobic parts in this book again:<br/><br/>p. 39:<br/><blockquote><br/>Most of all I dreaded paying a bill - my awkwardness when I handed over the money after buying something did not arise from stinginess, but from excessive tension, excessive embarrassment, excessive uneasiness and apprehension.<br/></blockquote><br/><br/>All good art has some truth in it:<br/>p. 17:<br/><blockquote><br/>I thought, ""As long as I can make them laugh, it doesn't matter how, I'll be all right. If I succeed in that, the human beings probably won't mind it too much if I remain outside their lives. The one thing I must avoid is becoming offensive to their eyes, I shall be nothing, the wind, the sky.""<br/></blockquote><br/><br/>"						0
144977	The Tender Bar	J.R. Moehringer	Moehringer, J.R.		0786888768	9780786888764	5	3.91	Hachette Books	Paperback	432	2006	2005		2013/04/11			read							0
11762	White Noise	Don DeLillo	DeLillo, Don		0140283307	9780140283303	3	3.86	Penguin Books	Paperback	320	1999	1985	2013/10/18	2013/04/08	america	america (#7)	read	"Nothing much happens, except it's sometimes funny. Maybe I'm too young for this, maybe I should've read this back when it came out. This way, the whole ""look at our ridiculous culture and our ridiculous jobs and our ridiculous problems cavemen wouldn't have had"" schtick feels tired, there's a million books like this now - I guess White Noise is to blame for that?"						0
35519	The Power of Myth	Joseph Campbell	Campbell, Joseph	Bill Moyers	0385418868	9780385418867	4	4.28	Anchor Doubleday	Paperback	320	2011	1988	2013/05/19	2013/04/05	non-fiction, mythology	non-fiction (#9), mythology (#1)	read	"This is not really a non-fiction book, but a dialogue between Joseph Campbell (professor who specialized in comparative mythology/religion) and Bill Moyers, a journalist. It's all about Campbell's lifework, which was to compare different mythologies of different cultures and continents and find all the overlapping tropes - and there's lots to be found.<br/><br/>This book shines when Campbell starts to tell all these stories from Native Americans, Inuit, Hindus and Buddhists and shows how they share common motifs and how they are essentially just one big story. It's also great when he criticizes Christianity:<br/><br/><blockquote>Moyers: In the Christian story the serpent is the seducer.<br/><br/>Campbell: That amounts to a refusal to affirm life.</blockquote><br/><br/>I would've given it five stars were it not for Campbell continuously accepting stories as fact, for example:<br/><br/><blockquote>There's a Czechoslovakian psychiatrist, Stanislav Grof, now living in California, who for years treated people with LSD. And he found that some of them re-experienced birth [...]. Isn't it amazing that this repeats just what the myth says?</blockquote><br/><br/>Now Campbell hints here that this is an event re-experiencing something that actually happens, when in reality, it might just have been the drug, no experience necessary. He likes to do this - he often goes out on a leg and states things he can't prove. My biggest peeve is with his central statement of ""Follow your bliss"" - that there's something roughly akin to destiny that is manifested in the things you like. So to be happy you follow that path of your preferences and that is the only way. It's a bit of an unfair thing - if your circumstances prohibit you from following bliss, what then?<br/><br/>He's a bit unfair in other parts, too:<br/><blockquote>Freud tells us to blame our parents for all the shortcomings of our life, and Marx tells us to blame the upper class of our society. But the only one to blame is oneself. That's the helpful thing about the Indian idea of karma. Your life is the fruit of your own doing. You have no one to blame but yourself.</blockquote> - says the Upper Middle Class white guy who could afford to go to university.<br/><br/>Nonetheless, I learned a lot about myths and it was a pleasure reading. It's great when he compares the motifs in Star Wars 4-6 to mythological motifs - and they constantly come back to it! He would've hated Episode 1.<br/><br/>Recommended for: People who get stuck browsing TVTropes.<br/><br/>Not recommended for: People not interested in the fabrics of society"						0
13821	Lord of Light	Roger Zelazny	Zelazny, Roger		0060567236	9780060567231	4	4.1	Harper Voyager	Paperback	296	2010	1967	2013/04/08	2013/04/02	religion, uprising	religion (#1), uprising (#1)	read							0
